{"schema_version":"zerostack.cas-gc.v1","record_type":"dry-run-report","run_id":"uncertainty-boundary","store_root":"/shared/cas","evaluated_at":"2026-07-11T12:00:00Z","objects":[{"blob_hash":"0123456789abcdef0123456789abcdef0123456789abcdef0123456789abcdef","verdict":"retain-uncertain","reason_codes":["uncertain-metadata"],"evidence":["gc/roots/fszero/aaaaaaaaaaaaaaaaaaaaaaaaaaaaaaaaaaaaaaaaaaaaaaaaaaaaaaaaaaaaaaaa/current.json"]},{"blob_hash":"abcdefabcdefabcdefabcdefabcdefabcdefabcdefabcdefabcdefabcdefabcd","verdict":"collect","reason_codes":["no-live-reference"],"evidence":[]}]}
