{"schema_version":"zerostack.cas-gc.v1","record_type":"dry-run-report","run_id":"all-verdicts","store_root":"/shared/cas","evaluated_at":"2026-07-11T12:00:00Z","objects":[{"blob_hash":"0123456789abcdef0123456789abcdef0123456789abcdef0123456789abcdef","verdict":"retain","reason_codes":["reachability-root"],"evidence":["gc/roots/tokenzero/aaaaaaaaaaaaaaaaaaaaaaaaaaaaaaaaaaaaaaaaaaaaaaaaaaaaaaaaaaaaaaaa/current.json"]},{"blob_hash":"abcdefabcdefabcdefabcdefabcdefabcdefabcdefabcdefabcdefabcdefabcd","verdict":"collect","reason_codes":["no-live-reference"],"evidence":[]},{"blob_hash":"cccccccccccccccccccccccccccccccccccccccccccccccccccccccccccccccc","verdict":"retain-uncertain","reason_codes":["corrupt-metadata"],"evidence":["gc/leases/graphzero/bbbbbbbbbbbbbbbbbbbbbbbbbbbbbbbbbbbbbbbbbbbbbbbbbbbbbbbbbbbbbbbb/broken.json"]}]}
